pk,amsd_id,title,keywords,description,obj_creator,date_created,note_place_created,place_created,item_type,ling_area_1,ling_area_2,ling_area_3,notes_ling_area,stick_term,message,motifs,motif_transcription,sem_domain,dim_1,dim_2,dim_3,material,technique,source_citation,source_type,date_collected,holder_file,holder_obj_id,collector,place_collected,creator_copyright,file_copyright,lat,long,notes_coords,url_institution,url_source_1,url_source_2,irn,notes,data_entry,linked_filenames
1,RBS1878P354F171,Sketch of a message stick from Brough Smythe's Aborigines of Victoria (1878),1;2,Sketch of message stick on p354 of R. Brough Smythe's 'Aborigines of Victoria',"Recipient: ""An Aboriginal named Jacob"" (p354)",1870,terminus ante quem,,1,,,,,,"A native trooper, belonging to another part of the country, gave an interpretation of the symbols. (p. 354), """" Charbig"" the native trooper, said that the symbols conveyed the following: intelligence — ""Two blackfellows come up in two days seventeen days ago. One blackfellow come up to where this fellow (Jacob) sit down. The track shown on the stick means that from the place where the blackfellows set out to Brisbane. The message means that the Aboriginals were taking steps to aid Jacob in some attempt at escape."" (p. 355)",,,1;2;3,,,,,,1,,,,,"It was sent to me [Brough Smythe] by Mr. N. Bartley, who says, in a letter dated 21st June 1870, that it was given to him by the Honorable R. Pring, Q.C., Attorney-General of the colony. (p.354)",,,,,,,,http://archive.org/stream/aboriginesofvict01smyt#page/n7/mode/2up,,,,1,1;2
2,PRM1989.46.3,"A message stick held in the Pitt Rivers Museum, and reproduced by A.W. Howitt (1889, 1904)",1;3;4;5;6;7,"Message stick holder: Pitt Rivers Museum.   Object description: ""Notched wooden message stick with incised pattern. The marks are said not to have any meaning beyond being connected in the messengers mind with his message. [JN 05/03/2014]""  Sketch of message stick fig (1) in 'Notes on Australian Message Sticks and Messengers' (Howitt 1889, pp. 330-331) and Sketch of message stick (fig. 1) on p. 696 in Howitt's 1904 ""The native tribes of southeast Australia""","This [Woiworung] is now all but extinct-one survivor is the intelligent old bard whose songs Dr. Torrance has recorded, and whom I have had before occasion to refer to as my authority for the customs of his people, of which he is a complete repository (1889, p316)    ""My informant Berak"" (1889, p. 318)    ""Maker: William Barak ?"" (PRM Catalogue)",1883,terminus ante quem,,2,1,,,"The message stick is associated with the “Woiworung tribe, Victoria” (Howitt 1889, p.331).",,"The notches on the upper right hand side of the stick represent the sender, and other old men who join with him in the message. Those on the under side represent the recipient and the old men with him. The remainder of the stick being notched along the whole length above and below means that all the men of both localities are to be present. The markings on the flat side at the right hand are merely ornamental, as are also the crescent-shaped ends of the stick. This message is supposed to be an invitation to some people at a distance to come to a corroboree. (Howitt 1889, p. 318)    ""Message stick of Woiworung tribe, Victoria, to collect an assembly for corroboree. The reverse is plain. Scale one-half linear."" (Howitt 1889, p. 331)    ""The notches on the upper end at the left hand of the stick represent the sender and other old men with him. The remainder of the stick being notched along the whole of the two sides, means that all the men of both localities are to be present. The markings on the flat side, at the lower end, are only for ornament, as are also the crescent-shaped ends of the stick. This message is an invitation to some people at a distance to come to a corrobboree."" (Howitt 1904, p.702)",,,4;5;6;7;8,140,13,,1,1;2;3,2;3,1;2;3,June 1883,1,1989.46.3,"Field Collector, Owner: Alfred William Howitt   PRM Source: Alfred William Howitt via Edward Burnett Tylor?   Acquired: Found unentered 1989. (Donated 1888.)",,,,,,,http://objects.prm.ox.ac.uk/pages/PRMUID5156.html,http://nla.gov.au/nla.obj-26171094,http://archive.org/stream/nativetribesofso00howiuoft#page/n7/mode/2up,,"On 12.08.2016 this record was merged with Record ID: 500_29557, created for the same artefact in Howitt's 1904 text.   Glossary: entered    PRM Catalogue:  ""Found unentered 1989. Collector's No. 6. Notched message stick with incised pattern. Its purpose was to invite people to come to a corroboree. Groups of notches denote the senders, the recipients of the message and the fact that ALL the men are invited. [LMM?]This interpretation does not tally with notes sent from Howitt to Tylor 'the marks are said not to have any meaning beyond being connected in the messengers mind with his message'. [JN 05/03/2014]    Written on object - '6. JUNE 25 '89 A B' [AH 03/04/2013]    Related Documents File - Article written by A.W. Howitt entitled: 'Notes on Australian Message Sticks and Messengers' from JAI Volume XVIII 1889 [See file for full text.] [ZM 6/1/2016]    Possibly made by William Barak a man who witnessed the signing of the John Batman treaty in 1835, between Batman and a group of Aboriginal elders.(see research notes). Probably number 6 in the list in the letter from Howitt to Tylor: ""(6) Woi- worung message stick, the marks are said not to have any meaning beyond being connected in the messengers mind with his message. Woi-worung was the name of the tribe living above Melbourne."" [JN 27/03/2013]    Display history: Possibly displayed at the PRM from as early as 1888 with other examples from the Howitt collection of message-sticks (1989.46) (see photograph A23.F11.1, taken in 1995). [JC 11 1 2006]    Loaned to the Crafts Council for their exhibition Codes and Messages: Lettering Today, held at the Crafts Council Gallery, Islington, London, from 30 November 1995 to 4 February 1996. [JC]    Requested for loan to the First People exhibition at Bunjilaka Cultural Centre, Melbourne Museum. Loan agreed February 2013. Loan temporarily withdrawn April 2013 with possible year-long delay. [JN 27/03/2013]    Publications history, trails & websites: Illustrated as figure 1 in Plate XIV (entitled 'Australian Message Sticks') opposite page 331 of 'Notes on Australian Message Sticks and Messengers', by A. W. Howitt, in Journal of the Anthropological Institute, Vol XVIII, 1889, pp. 314-332. (Copy in RDF). NB The original pencil drawings by Alfred Robinson used to produce the figures in Plate XIV are held in the PRM Manuscript Collections: Pitt Rivers Museum Papers / Box 2 / 1-3. [JC 20 9 2000, 17 6 2008]    Research notes: In an email to the PRM dated 7 October 2012, from Michael Reason (Curator, History and Technology, Humanities Department, Museum Victoria) writes: 'From research carried out after one of our curators visited the Pitt Rivers Museum in 2011, we believe that it was probably made by William Barak, a man who witnessed the signing of the John Batman treaty in 1835, between Batman and a group of Aboriginal elders.' (Printout in RDF.) [JC 9 10 2012]    The Australian Dictionary of Biography includes an entry for William Barak (1824-1903) that notes: He was Howitt's chief informant for central and south-west Victoria and elsewhere [for the full entry see http://adb.anu.edu.au/biography/barak-william-2930]. [ZM 14/02/2013]    This is probably one of the object mentioned in a letter from Howitt [Howitt 10] of the Tylor papers PRM ms collections Box 12 of June 25 1883:     'Dear Dr Tylor Your letter of the 13th May reminds me that I have not yet sent the turndun which I promised in my last letter. The reason is that I have been waiting until I could get them carefully drawn in order that I may have their versimilitudes for reference. I shall now send the following within the next two days in one or parcels [sic] as I find they may require for travel purposes    (1) Murring Mudthi (bullroarer) used at Mileatom [?] and found [illegible] factory. [insert] The notch at the end represents the gap where the tooth has been knocked out [end insert]    (2) Dieri -- Yuntha (Bullroarer) This was used at the Dieri ceremonies and also by me at those of the Coast Murring    (3) Chepara Message stick I am not able to get an explanation of the marks. It seems probable that the existing blackfellows of the Chepara tribe (on the coast south of Brisbane) have forgotten the meaning. Mr Gibson to whom I am indebted for this stick tells me that his informant states that his father used to make these sticks but that he only knew of the meaning of the marks.    (4) Dieri message token of Emu feathers. The messenger carries this and delivers the message by word of mouth    (5) Narrinyeri message stick No explanation can be given of the marks. Narringyeri tribe is at the Murray River mouth    (6) Woi-worung message stick. the marks are said not to have had any meaning beyond being connected in the messengers mind with his message. Woi-worung was the name of the tribe living above Melbourne.    (7) Message stick used on the Diamantina River [insert] Queensland [end insert] So far as I can learn the marks are the enumeration of men who are invited to attend the details being given by the messenger.    (8) Gournd[insert] i [end insert]tch mara message stick. I am told that this stick was sent with the messenger who conveyed the message by word of mouth    (9) Dieri net. This net ""yamma"" was delivered to the Pinya (armed party) when any person was doomed to death by the Great Council of the Dieri tribe and the offender having been killed, this net was laid upon him as a sign to all concerned. Let me mention here that this Great Council was composed to the principal men of the Dieri tribe. The Heads of Murdus (Totems) Warriors, Orators, Wizards and held its meetings in secret. This great Council was supreme and different from the General Council which consisted of all the initiated men of the tribe.     10. Aaja-dura - Bullroarer. I cannot at present turn up the letter in which my correspondents gave me the name of this example. It was sent to me by the Headman of this tribe which inhabits Yorks Peninsula S.A. in return for a bullroarer which I sent to him. The old man showeed mine to my correspondent with much mystery after sending all the women away from the place    These are all the contributions which I can send you this time but more will follow as soon as I can get them drawn -- I do this because I cannot yet tell whether in the work for which I am gathering materials I may or may not require illustrations of these things. This will not however in any way affect any use to which you may decide to put them. They are yours to do with as you like. If there are any other blackfellows implements which you want I shall be delighted to try and obtain them for you. [AP 05/02/2013]",1,3;4;5;6;7;8
3,4PRM1989.46.9,"A message stick from New South Wales held in the Pitt Rivers Museum, and reproduced by A.W. Howitt (1889, 1904)",1;3;6;4;8,"Message stick holder: Pitt Rivers Museum, ""Message stick, wrapped in string. The stick is carved to a tip at one end. The cotton string is wrapped around the centre of the stick.""    Sketch of message stick (fig. 4) in Howitt's 'Notes on Australian message sticks and messengers', p. 331    Sketch of message stick (fig.5) on p. 704 of Howitt's 1904 ""The native tribes of southeast Australia""","Sender: ""a Tongaranka blackfellow""  Recipient: ""two of his friends"" (1889 p. 327; 1904, p692)",1883,terminus ante quem,,2,2,,,"The message stick is associated with the “Tongaranka tribe”: ""Message stick from a man of the Tongaranka tribe"" (Howitt 1889, p.331). New South Wales.    See Tongaranka synonyms at AIATSIS: https://collection.aiatsis.gov.au/austlang/language/d21    Harald wrote: ""Wanyiwalku is there [in Glottolog] as Bagundji [bagu1250]""    Claire wrote: ""https://glottolog.org/resource/languoid/id/darl1243 is the cover term for  Paakintyi (of which Wanyiwalku/Pantyikali is a variety); Harald will have  to say why he chose the three varieties he did as sub-varieties.""    Piers decision: Bagundji [bagu1250] will be used to represent ""Tongaranka"" (ie Wanyiwalku) until Wanyiwalku is represented as a subvariety within glottolog.",,"Fig. 4, Plate XIV, represents a message stick sent by a Tongaranka blackfellow inviting two of his friends at a distance to come and see him as his wife was ill and could not travel. The notch (a) means the sender; (b)and (c) the two men invited. The stick was wrapped round with a piece of thread to render it less liable  to be lost. (Howitt 1889, p. 327)    ""[...] a Tongaranka blackfellow inviting two of his friends at a distance to come and see him as his wife was ill and could not travel. The notch (a) means the sender; (b) and (c) the two men invited."" (p. 327) ""Fig. 4. Message stick from a man of the Tongaranka tribe, (a) the sender of the message, (b), (c) the two men initiated by (a) to meet him."" (Howitt 1889, p. 331)    ""No. 5 represents a message-stick sent by a man of the  Tongaranka tribe, inviting two of his friends at a distance to come and see him, as his wife was ill and could not travel. The lower notch represents the sender, and the two others the men invited.  This message-stick is made of part of a small branch of a tree, and is wrapped round with a few strands of a man's kilt, with which article of man's attire the boy is invested after initiation. The whole is tied up in about two feet of the cord made of twisted opossum fur, which the novice wears for a time, after his initiation, as evidence of his having been made a "" young man."" "" (Howitt 1904, p. 692)",,,9;10;11;12,52,17,,1;2,1;3;4,2;3,3;4,1883,1,1989.46.9,"Field Collector: Alfred William Howitt  PRM Source: Alfred William Howitt via Edward Burnett Tylor? Acquired: Found unentered, 1989 Donated 1888",,,,,,,http://objects.prm.ox.ac.uk/pages/PRMUID5162.html,http://nla.gov.au/nla.obj-26171094,https://archive.org/stream/nativetribesofso00howiuoft#page/704,,"Merged with ID: 500_29583 (same sketch from 'Native tribes' 1904)  PRM Catalogue: ""Display history: Possibly displayed at the PRM from as early as 1888 with other examples from the Howitt collection of message-sticks (1989.46) (see photograph A23.F11.1, taken in 1995). [JC 11 1 2006]    Publications history, trails & websites: Illustrated as figure 4 in Plate XIV (entitled 'Australian Message Sticks') opposite page 331 of 'Notes on Australian Message Sticks and Messengers', by A. W. Howitt, in Journal of the Anthropological Institute, Vol XVIII, 1889, pp. 314-332. (Copy in RDF). NB The original pencil drawings by Alfred Robinson used to produce the figures in Plate XIV are held in the PRM Manuscript Collections: Pitt Rivers Museum Papers / Box 2 / 1-3. [JC 20 9 2000, 17 6 2008]""",1,9;10;11;12
4,EMB_VI_NLS4370,A message stick from Queensland held in the Ethnologisches Museum Berlin,1;4;6,"This message stick is held in the Ethnologisches Museum in Berlin but it is described simply as ""Botenstab"" and is not associated with a catalogue entry. The 'NLS' on the tag means nummerlos. Nonetheless it is identicle to a sketch published as Figure 5 in A. W. Howitt's 'Notes on Australian message sticks and messengers'. It is not clear how it made its way to the EMB.",,1883-08,terminus ante quem,,2,3,4,,"The message stick is associated with the “Maikulon tribe"":   ""a man of the Maikulon tribe, to a man of the Maiapi tribe."" (Howitt 1889, p.327)  ""Message stick sent by a man of the Maikulon tribe, to a man of the Maiapi tribe in Northern Queensland""  (p. 331)      Maikulon is a synonym of Mayi-Kulan.    Maiapi is a synonym of Mayi-Yapi.    In the Ethnologisches Museum catalogue it is described simply as being from Queensland.",,"The one shown by fig 5, Plate XIV, is a friendly reminder or greeting, carried without any message excepting the sender's name by Mr. Palmer from a man of the Maikulon tribe, to a man of the Maiapi tribe. (Howitt 1889, p. 327)    ""Fig. 5. Message stick sent by a man of the Maikulon tribe, to a man of the Maiapi tribe in Northern Queensland, as a friendly reminder. Half scale."" (p. 331)",,,13,142,16,13,1,3;2,2,3;4,August 1883,2,VI NLS 4370,Franz Reuleaux,,,,,,,,http://nla.gov.au/nla.obj-26171094,,,PK: Still more data to enter from EMB computer file print-out,1,13;14;15;16;17;18;19
5,PRM1989.46.8,"A message stick from North Queensland held in the Pitt Rivers Museum, and reproduced by A.W. Howitt (1889)",1;4;6,Message stick holder: Pitt Rivers Museum;  Two sketches of the same message stick showing front and back facets (fig. 6 and fig. 7) in Howitt's 'Notes on Australian message sticks'.,,1889,terminus ante quem,,2,,,,"The message stick is associated with the “Kugobathi tribe"":  ""the Kugobathi tribe, at the Mitchell River which flows into the Gulf of Carpentaria"" (Howitt 1889, p.327)  ""Message stick sent by a man at the Flinders River in North Queensland, to a friend at the Mitchell River"" (p. 331-332)",,"The one given in figs. 6 and 7 of Plate XIV, represents the front and reverse of a message stick sent by a blackfellow at the Flinders River to another at the Mitchell River, to inform him that his wife was dead. (Howitt 1889, p. 327)    ""These are examples of the more ornamented class message sticks which are used in some places."" (Howitt 1889, p. 327)    ""Figs. 6 and 7. Message stick sent by a man at the Flinders River in North Queensland, to a friend at the Mitchell River, to inform him that his wife was ill. Half scale.""(p.331-332)    ""Message stick sent by a man at Flinders River to a friend at Mitchell River, to inform him that his wife was dead, the white pipeclay (the mourning colour) being symbolically used to denote death. Kugobathi"" (PRM Catalogue)",,,9;11,58,10,,1;3,1;2,2,3;4,August 1883,1,1989.46.8,"Field Collector: Edward Palmer  Other Owners: Alfred William Howitt  PRM Source: Alfred William Howitt via Edward Burnett Tylor?   Acquired: Found unentered 1989, Donated 1888",,,,,,,http://objects.prm.ox.ac.uk/pages/PRMUID5161.html,http://nla.gov.au/nla.obj-26171094,,,"PRM Catalogue: ""Display history: Possibly displayed at the PRM from as early as 1888 with other examples from the Howitt collection of message-sticks (1989.46) (see photograph A23.F11.1, taken in 1995). [JC 11 1 2006]    Loaned to the Crafts Council for their exhibition Codes and Messages: Lettering Today, held at the Crafts Council Gallery, Islington, London, from 30 November 1995 to 4 February 1996. [JC]    Publications history, trails & websites: Illustrated as figure 7 in Plate XIV (entitled 'Australian Message Sticks') opposite page 331 of 'Notes on Australian Message Sticks and Messengers', by A. W. Howitt, in Journal of the Anthropological Institute, Vol XVIII, 1889, pp. 314-332. (Copy in RDF). NB The original pencil drawings by Alfred Robinson used to produce the figures in Plate XIV are held in the PRM Manuscript Collections: Pitt Rivers Museum Papers / Box 2 / 1-3. [JC 20 9 2000, 17 6 2008]        Research notes: Described in Tylor papers Box 12 PRM ms collections Howitt 11 as 'August 8 1883 ... Message stick sent by a Flinders River blackfellow to another at the Mitchell River to say his wife was dead. From Mr Palmer. [3] [AP 06/02/2013]""",1,20;21;22;23
6,AWH1889P330F8,"Sketch of a message stick from Victoria reproduced in two A.W. Howitt's publications (1889, 1904)",1;3;6;9,"Sketch of a message stick fig. 8 in 'Notes on Australian message sticks and messengers' (Howitt 1889) and fig. 5 in 'The native tribes of southeast Australia' (Howitt 1904, p.704).","It conveys a message from the head-man of the Gromillŭkhorde, to the people of the Yarik-kŭllŭk horde at Lake Coorong, both being local divisions of the Wotjo-baluk tribe. (Howitt 1889, 320)",1889,terminus ante quem,,1,5,,,"The message stick is associated with the “Wotjoballuk tribe, Victoria"" (Howitt 1889, p.332)/ ""Wotjobaluk tribe"" (Howitt 1904)    ""It conveys a message from the head-man of the Gromillŭk horde, to the people of the Yarik-kŭllŭk horde at Lake Coorong, both being local divisions of the Wotjobaluk tribe."" (Howitt 1889, p. 321)    ""This kind of message-stick, called galk, that is, wood or stick, may be seen by any one."" (Howitt 1904 p. 698)","galk (Howitt 1904, p. 698)","It conveys a message from the head-man of the Gromillŭk horde, to the people of the Yarik-kŭllŭk horde at Lake Coorong, both being local divisions of the Wotjobaluk tribe. The message invited all the people to come to a corroboree.    The notches at (a) represent the sender and his four friends, being the principal men at Gromilluk. The notches at (b) represent the Yari-kuluk people. The notches continuing along the edge to the end on each edge indicates that all the people are to come. The shape of the stick is due to it having [320] been made from a crooked branch of a tree, and is not intentional. (Howitt 1889, p. 321)    ""Message stick of the Wotjoballuk tribe, Victoria, sent to invite an assembly for corroboree; (a) the sender of the message and four friends, (c) the recipient. The other notches indicate that all the people with (b) are to attend. Half scale."" (Howitt 1889, p. 332)    ""The illustration, Fig. 43, No. 5, represents one of these sticks, which was made to convey an invitation from the Headman of the Gromilluk horde to the Yarik-kulluk horde at Lake Coorong, both being local divisions of the Wotjobaluk tribe. All the people were invited to attend. The three notches at the upper end on the right-hand side show the sender and his friends, who were the principal Gromilluk men. The large notch represents the Yarik-killuk horde and its Headman, to whom the message was sent. The notches continuing along the edge to the end and along the other edge indicate all the people of the horde being invited."" (Howitt 1904, p. 697)",,,7;4;5;6;8,,,,,,2;3,1;2,,,,,,,,,,,http://nla.gov.au/nla.obj-26171094,,,,Merged with Record ID: 500_29581 on 12.08.2016 by Piers Kelly,1,24;25;26;27
