Title	Keywords	Description	Creator of Object	Date Created	Notes on date created	Place Created	Object Type	Linguistic area	Linguistic area 2	Linguistic area 3	Notes on Linguistic area(s)	Term for 'message stick' in language	Message	Motifs	Motif transcription	Semantic domain	Dimension 1 (mm)	Dimension 2 (mm)	Dimension 3 (mm)	Material	Technique	Source citation	Source type	Date Collected	Institution/Holder: file	Institution/Holder: object identifier	Collector	Place Collected	Creator Copyright	File Copyright	Latitude	Longitude	Notes on coordinates	Spatial Coverage	URL (collecting institution)	URL (source document)	URL (source document 2)	IRN	Notes	OCCAMS Author	Linked Filename
Sketch of a message stick from Brough Smythe's Aborigines of Victoria (1878)	interpreted_artefact  unbound    	Sketch of message stick on p354 of R. Brough Smythe's 'Aborigines of Victoria'	Recipient: "An Aboriginal named Jacob" (p354)	1870	terminus ante quem	 	Image of a message stick (artefact missing)	 	 	 	 	 	"A native trooper, belonging to another part of the country, gave an interpretation of the symbols." (p. 354), "" Charbig" the native trooper, said that the symbols conveyed the following: intelligence — "Two blackfellows come up in two days seventeen days ago. One blackfellow come up to where this fellow (Jacob) sit down. The track shown on the stick means that from the place where the blackfellows set out to Brisbane. The message means that the Aboriginals were taking steps to aid Jacob in some attempt at escape." (p. 355)	 	 	sd_journey  sd_time  sd_request_help	 	 	 	 	 	Brough Smythe, R. 1878. The Aborigines of Victoria: With notes relating to the habits of natives of other parts of Australia and Tasmania. Vol. I. Melbourne & London: John Ferres. 	 	 	 	 	"It was sent to me [Brough Smythe] by Mr. N. Bartley, who says, in a letter dated 21st June 1870, that it was given to him by the Honorable R. Pring, Q.C., Attorney-General of the colony." (p.354)	 	 	 	 	 	 	 	 	http://archive.org/stream/aboriginesofvict01smyt#page/n7/mode/2up	 	 	 	Piers Kelly	1878-Artefact1-Brough_Smythe-Aborigines_of_Victoria-vol1-p354.png;y-1878-Artefact1-Brough_Smythe-p354_black.png	
A message stick held in the Pitt Rivers Museum, and reproduced by A.W. Howitt (1889, 1904)	interpreted_artefact  glossed_artefact  ornament  multiple_sources  	Message stick holder: Pitt Rivers Museum.   Object description: "Notched wooden message stick with incised pattern. The marks are said not to have any meaning beyond being connected in the messengers mind with his message. [JN 05/03/2014]"  Sketch of message stick fig (1) in 'Notes on Australian Message Sticks and Messengers' (Howitt 1889, pp. 330-331) and Sketch of message stick (fig. 1) on p. 696 in Howitt's 1904 "The native tribes of southeast Australia"	"This [Woiworung] is now all but extinct-one survivor is the intelligent old bard whose songs Dr. Torrance has recorded, and whom I have had before occasion to refer to as my authority for the customs of his people, of which he is a complete repository" (1889, p316)    "My informant Berak" (1889, p. 318)    "Maker: William Barak ?" (PRM Catalogue)	1883	terminus ante quem	"Woiworung tribe, Victoria" (Howitt 1889, p.331)	Message stick in a collection	Chirila: Woiwurrung  Austlang: S36: Woiwurrung  Glottolog: woiw1237  	 	 	 	 	"The notches on the upper right hand side of the stick represent the sender, and other old men who join with him in the message. Those on the under side represent the recipient and the old men with him. The remainder of the stick being notched along the whole length above and below means that all the men of both localities are to be present. The markings on the flat side at the right hand are merely ornamental, as are also the crescent-shaped ends of the stick. This message is supposed to be an invitation to some people at a distance to come to a corroboree." (Howitt 1889, p. 318)    "Message stick of Woiworung tribe, Victoria, to collect an assembly for corroboree. The reverse is plain. Scale one-half linear." (Howitt 1889, p. 331)    "The notches on the upper end at the left hand of the stick represent the sender and other old men with him. The remainder of the stick being notched along the whole of the two sides, means that all the men of both localities are to be present. The markings on the flat side, at the lower end, are only for ornament, as are also the crescent-shaped ends of the stick. This message is an invitation to some people at a distance to come to a corrobboree." (Howitt 1904, p.702)  	 	 	sd_person_sender  sd_person_recipient  sd_request_invitation_ceremony  sd_ceremony  sd_person_group    	140	13	 	Wood Plant	Incised, Carved, Notched 	Howitt, A. W. 1889. “Notes on Australian Message Sticks and Messengers”. The Journal of the Anthropological Institute of Great Britain and Ireland 18. [Royal Anthropological Institute of Great Britain and Ireland, Wiley]: 314–32    Howitt, A. W. 1904. The native tribes of southeast Australia. London: Macmillan and Co., Limited.	Journal article  Book chapter  Museum Collection	June 1883	Pitt Rivers Museum	1989.46.3	Field Collector, Owner: Alfred William Howitt   PRM Source: Alfred William Howitt via Edward Burnett Tylor?   Acquired: Found unentered 1989. (Donated 1888.) 	 	 	 	 	 	 	 	http://objects.prm.ox.ac.uk/pages/PRMUID5156.html	http://nla.gov.au/nla.obj-26171094	http://archive.org/stream/nativetribesofso00howiuoft#page/n7/mode/2up	 	On 12.08.2016 this record was merged with Record ID: 500_29557, created for the same artefact in Howitt's 1904 text.   Glossary: entered    PRM Catalogue:  "Found unentered 1989. Collector's No. 6. Notched message stick with incised pattern. Its purpose was to invite people to come to a corroboree. Groups of notches denote the senders, the recipients of the message and the fact that ALL the men are invited. [LMM?]This interpretation does not tally with notes sent from Howitt to Tylor 'the marks are said not to have any meaning beyond being connected in the messengers mind with his message'. [JN 05/03/2014]    Written on object - '6. JUNE 25 '89 A B' [AH 03/04/2013]    Related Documents File - Article written by A.W. Howitt entitled: 'Notes on Australian Message Sticks and Messengers' from JAI Volume XVIII 1889 [See file for full text.] [ZM 6/1/2016]    Possibly made by William Barak a man who witnessed the signing of the John Batman treaty in 1835, between Batman and a group of Aboriginal elders.(see research notes). Probably number 6 in the list in the letter from Howitt to Tylor: "(6) Woi- worung message stick, the marks are said not to have any meaning beyond being connected in the messengers mind with his message. Woi-worung was the name of the tribe living above Melbourne." [JN 27/03/2013]    Display history: Possibly displayed at the PRM from as early as 1888 with other examples from the Howitt collection of message-sticks (1989.46) (see photograph A23.F11.1, taken in 1995). [JC 11 1 2006]    Loaned to the Crafts Council for their exhibition Codes and Messages: Lettering Today, held at the Crafts Council Gallery, Islington, London, from 30 November 1995 to 4 February 1996. [JC]    Requested for loan to the First People exhibition at Bunjilaka Cultural Centre, Melbourne Museum. Loan agreed February 2013. Loan temporarily withdrawn April 2013 with possible year-long delay. [JN 27/03/2013]    Publications history, trails & websites: Illustrated as figure 1 in Plate XIV (entitled 'Australian Message Sticks') opposite page 331 of 'Notes on Australian Message Sticks and Messengers', by A. W. Howitt, in Journal of the Anthropological Institute, Vol XVIII, 1889, pp. 314-332. (Copy in RDF). NB The original pencil drawings by Alfred Robinson used to produce the figures in Plate XIV are held in the PRM Manuscript Collections: Pitt Rivers Museum Papers / Box 2 / 1-3. [JC 20 9 2000, 17 6 2008]    Research notes: In an email to the PRM dated 7 October 2012, from Michael Reason (Curator, History and Technology, Humanities Department, Museum Victoria) writes: 'From research carried out after one of our curators visited the Pitt Rivers Museum in 2011, we believe that it was probably made by William Barak, a man who witnessed the signing of the John Batman treaty in 1835, between Batman and a group of Aboriginal elders.' (Printout in RDF.) [JC 9 10 2012]    The Australian Dictionary of Biography includes an entry for William Barak (1824-1903) that notes: He was Howitt's chief informant for central and south-west Victoria and elsewhere [for the full entry see http://adb.anu.edu.au/biography/barak-william-2930]. [ZM 14/02/2013]    This is probably one of the object mentioned in a letter from Howitt [Howitt 10] of the Tylor papers PRM ms collections Box 12 of June 25 1883:     'Dear Dr Tylor Your letter of the 13th May reminds me that I have not yet sent the turndun which I promised in my last letter. The reason is that I have been waiting until I could get them carefully drawn in order that I may have their versimilitudes for reference. I shall now send the following within the next two days in one or parcels [sic] as I find they may require for travel purposes    (1) Murring Mudthi (bullroarer) used at Mileatom [?] and found [illegible] factory. [insert] The notch at the end represents the gap where the tooth has been knocked out [end insert]    (2) Dieri -- Yuntha (Bullroarer) This was used at the Dieri ceremonies and also by me at those of the Coast Murring    (3) Chepara Message stick I am not able to get an explanation of the marks. It seems probable that the existing blackfellows of the Chepara tribe (on the coast south of Brisbane) have forgotten the meaning. Mr Gibson to whom I am indebted for this stick tells me that his informant states that his father used to make these sticks but that he only knew of the meaning of the marks.    (4) Dieri message token of Emu feathers. The messenger carries this and delivers the message by word of mouth    (5) Narrinyeri message stick No explanation can be given of the marks. Narringyeri tribe is at the Murray River mouth    (6) Woi-worung message stick. the marks are said not to have had any meaning beyond being connected in the messengers mind with his message. Woi-worung was the name of the tribe living above Melbourne.    (7) Message stick used on the Diamantina River [insert] Queensland [end insert] So far as I can learn the marks are the enumeration of men who are invited to attend the details being given by the messenger.    (8) Gournd[insert] i [end insert]tch mara message stick. I am told that this stick was sent with the messenger who conveyed the message by word of mouth    (9) Dieri net. This net "yamma" was delivered to the Pinya (armed party) when any person was doomed to death by the Great Council of the Dieri tribe and the offender having been killed, this net was laid upon him as a sign to all concerned. Let me mention here that this Great Council was composed to the principal men of the Dieri tribe. The Heads of Murdus (Totems) Warriors, Orators, Wizards and held its meetings in secret. This great Council was supreme and different from the General Council which consisted of all the initiated men of the tribe.     10. Aaja-dura - Bullroarer. I cannot at present turn up the letter in which my correspondents gave me the name of this example. It was sent to me by the Headman of this tribe which inhabits Yorks Peninsula S.A. in return for a bullroarer which I sent to him. The old man showeed mine to my correspondent with much mystery after sending all the women away from the place    These are all the contributions which I can send you this time but more will follow as soon as I can get them drawn -- I do this because I cannot yet tell whether in the work for which I am gathering materials I may or may not require illustrations of these things. This will not however in any way affect any use to which you may decide to put them. They are yours to do with as you like. If there are any other blackfellows implements which you want I shall be delighted to try and obtain them for you. [AP 05/02/2013]  	Piers Kelly	1889-Artefact_fig01-Howitt-Notes_on_Australian_message_sticks-p331.jpg;1904-Artefact01_fig43-Howitt-The_native_tribes-p696.JPG;PRM-1989.46.3_01.png;PRM-1989.46.3_02.png;PRM-1989.46.3_03.png;y-PRM-1989.46.3_01_traced_black.png	
A message stick from New South Wales held in the Pitt Rivers Museum, and reproduced by A.W. Howitt (1889, 1904)	interpreted_artefact  glossed_artefact  multiple_sources  localised_artefact  	Message stick holder: Pitt Rivers Museum, "Message stick, wrapped in string. The stick is carved to a tip at one end. The cotton string is wrapped around the centre of the stick."    Sketch of message stick (fig. 4) in Howitt's 'Notes on Australian message sticks and messengers', p. 331    Sketch of message stick (fig.5) on p. 704 of Howitt's 1904 "The native tribes of southeast Australia"	Sender: "a Tongaranka blackfellow"  Recipient: "two of his friends" (1889 p. 327; 1904, p692)	1883	terminus ante quem	"Message stick from a man of the Tongaranka tribe" (p. 331)  New South Wales.	Message stick in a collection	Chirila: Wanyiwalku  Austlang: D21: Wanyiwalku  Glottolog: bagu1250  	 	 	See Tongaranka synonyms at AIATSIS: https://collection.aiatsis.gov.au/austlang/language/d21    Harald wrote: "Wanyiwalku is there [in Glottolog] as Bagundji [bagu1250]"    Claire wrote: "https://glottolog.org/resource/languoid/id/darl1243 is the cover term for  Paakintyi (of which Wanyiwalku/Pantyikali is a variety); Harald will have  to say why he chose the three varieties he did as sub-varieties."    Piers decision: Bagundji [bagu1250] will be used to represent "Tongaranka" (ie Wanyiwalku) until Wanyiwalku is represented as a subvariety within glottolog. 	 	"Fig. 4, Plate XIV, represents a message stick sent by a Tongaranka blackfellow inviting two of his friends at a distance to come and see him as his wife was ill and could not travel. The notch (a) means the sender; (b)and (c) the two men invited. The stick was wrapped round with a piece of thread to render it less liable  to be lost." (Howitt 1889, p. 327)    "[...] a Tongaranka blackfellow inviting two of his friends at a distance to come and see him as his wife was ill and could not travel. The notch (a) means the sender; (b) and (c) the two men invited." (p. 327) "Fig. 4. Message stick from a man of the Tongaranka tribe, (a) the sender of the message, (b), (c) the two men initiated by (a) to meet him." (Howitt 1889, p. 331)    "No. 5 represents a message-stick sent by a man of the  Tongaranka tribe, inviting two of his friends at a distance to come and see him, as his wife was ill and could not travel. The lower notch represents the sender, and the two others the men invited.  This message-stick is made of part of a small branch of a tree, and is wrapped round with a few strands of a man's kilt, with which article of man's attire the boy is invested after initiation. The whole is tied up in about two feet of the cord made of twisted opossum fur, which the novice wears for a time, after his initiation, as evidence of his having been made a " young man." " (Howitt 1904, p. 692)	 	 	sd_person_woman_wife  sd_request_invitation  sd_illness  sd_person	52	17	 	Wood Plant  Cotton Yarn Plant	Incised, Notched, Bound 	Howitt, A. W. 1889. “Notes on Australian Message Sticks and Messengers”. The Journal of the Anthropological Institute of Great Britain and Ireland 18. [Royal Anthropological Institute of Great Britain and Ireland, Wiley]: 314–32; Howitt, A. W. 1904. The native tribes of southeast Australia. London: Macmillan and Co., Limited.	Museum collection  Book article	1883	Pitt Rivers Museum	1989.46.9	Field Collector: Alfred William Howitt  PRM Source: Alfred William Howitt via Edward Burnett Tylor? Acquired: Found unentered, 1989 Donated 1888	 	 	 	 	 	 	 	http://objects.prm.ox.ac.uk/pages/PRMUID5162.html	http://nla.gov.au/nla.obj-26171094	https://archive.org/stream/nativetribesofso00howiuoft#page/704	 	Merged with ID: 500_29583 (same sketch from 'Native tribes' 1904)  PRM Catalogue: "Display history: Possibly displayed at the PRM from as early as 1888 with other examples from the Howitt collection of message-sticks (1989.46) (see photograph A23.F11.1, taken in 1995). [JC 11 1 2006]    Publications history, trails & websites: Illustrated as figure 4 in Plate XIV (entitled 'Australian Message Sticks') opposite page 331 of 'Notes on Australian Message Sticks and Messengers', by A. W. Howitt, in Journal of the Anthropological Institute, Vol XVIII, 1889, pp. 314-332. (Copy in RDF). NB The original pencil drawings by Alfred Robinson used to produce the figures in Plate XIV are held in the PRM Manuscript Collections: Pitt Rivers Museum Papers / Box 2 / 1-3. [JC 20 9 2000, 17 6 2008]"	Piers Kelly	1889-Artefact_fig04-Howitt-Notes_on_Australian_message_sticks-p330-331.jpg;PRM-1989.46.9.png;1904-Artefact05_fig44-Howitt-The_native_tribes-p704.JPG;y-1889-Artefact_fig04-Howitt-Notes_on_Australian_message_sticks-p330-331_black.png	
A message stick held in the Pitt Rivers Museum, and reproduced by A.W. Howitt (1889)	interpreted_artefact  localised_artefact  multiple_sources  to_be_merged  	Message stick holder: Pitt Rivers Museum  Sketch of a message stick (fig. 5) from Howitt's 'Notes on Australian message sticks and messengers'	 	1883-08	terminus ante quem	"a man of the Maikulon tribe, to a man of the Maiapi tribe." (Howitt 1889, p.327)    "Message stick sent by a man of the Maikulon tribe, to a man of the Maiapi tribe in Northern Queensland"  (p. 331)	Message stick in a collection	Chirila: Mayi-Kulan  Austlang: G25: Mayi-Kulan  Glottolog: mayk1239	Chirila: Mayi-Yapi  Austlang: G20: Mayi-Yapi  Glottolog: mayi1235	 	Maikulon is a synonym of Mayi-Kulan.    Maiapi is a synonym of Mayi-Yapi.	 	"The one shown by fig 5, Plate XIV, is a friendly reminder or greeting, carried without any message excepting the sender's name by Mr. Palmer from a man of the Maikulon tribe, to a man of the Maiapi tribe." (Howitt 1889, p. 327)    "Fig. 5. Message stick sent by a man of the Maikulon tribe, to a man of the Maiapi tribe in Northern Queensland, as a friendly reminder. Half scale." (p. 331)  	 	 	sd_reminder	56	11	 	Wood Plant	Notched, Carved	Howitt, A. W. 1889. “Notes on Australian Message Sticks and Messengers”. The Journal of the Anthropological Institute of Great Britain and Ireland 18. [Royal Anthropological Institute of Great Britain and Ireland, Wiley]: 314–32	Museum collection  Book article	August 1883	Pitt Rivers Museum	1989.46.7	 	 	 	 	 	 	 	 	 	http://nla.gov.au/nla.obj-26171094	 	 	This one appears to have been misidentified as another message stick at the Pitt Rivers Museum: PRM-1989.46.7-01	Piers Kelly	1889-Artefact_fig05-Howitt-Notes_on_Australian_message_sticks-p330-331.jpg;EMB-VI_NLS_4370-05.jpg;EMB-VI_NLS_4370-01.jpg;EMB-VI_NLS_4370-04.jpg;EMB-VI_NLS_4370-06.jpg;EMB-VI_NLS_4370-02.jpg;EMB-VI_NLS_4370-03.jpg	
A message stick from North Queensland held in the Pitt Rivers Museum, and reproduced by A.W. Howitt (1889)	interpreted_artefact  localised_artefact  multiple_sources	Message stick holder: Pitt Rivers Museum;  Two sketches of the same message stick showing front and back facets (fig. 6 and fig. 7) in Howitt's 'Notes on Australian message sticks'. 	 	1889	terminus ante quem	"the Kugobathi tribe, at the Mitchell River which flows into the Gulf of Carpentaria" (Howitt 1889, p.327)    "Message stick sent by a man at the Flinders River in North Queensland, to a friend at the Mitchell River" (p. 331-332)	Message stick in a collection	 	 	 	 	 	"The one given in figs. 6 and 7 of Plate XIV, represents the front and reverse of a message stick sent by a blackfellow at the Flinders River to another at the Mitchell River, to inform him that his wife was dead." (Howitt 1889, p. 327)    "These are examples of the more ornamented class message sticks which are used in some places." (Howitt 1889, p. 327)    "Figs. 6 and 7. Message stick sent by a man at the Flinders River in North Queensland, to a friend at the Mitchell River, to inform him that his wife was ill. Half scale."(p.331-332)    "Message stick sent by a man at Flinders River to a friend at Mitchell River, to inform him that his wife was dead, the white pipeclay (the mourning colour) being symbolically used to denote death. Kugobathi" (PRM Catalogue)	 	 	sd_person_woman_wife  sd_illness	58	10	 	Wood Plant  Kaolin Clay 	Incised  Carved 	Howitt, A. W. 1889. “Notes on Australian Message Sticks and Messengers”. The Journal of the Anthropological Institute of Great Britain and Ireland 18. [Royal Anthropological Institute of Great Britain and Ireland, Wiley]: 314–32	Museum collection  Book article	August 1883	Pitt Rivers Museum	1989.46.8	Field Collector: Edward Palmer  Other Owners: Alfred William Howitt  PRM Source: Alfred William Howitt via Edward Burnett Tylor?   Acquired: Found unentered 1989, Donated 1888 	 	 	 	 	 	 	 	http://objects.prm.ox.ac.uk/pages/PRMUID5161.html	http://nla.gov.au/nla.obj-26171094	 	 	PRM Catalogue: "Display history: Possibly displayed at the PRM from as early as 1888 with other examples from the Howitt collection of message-sticks (1989.46) (see photograph A23.F11.1, taken in 1995). [JC 11 1 2006]    Loaned to the Crafts Council for their exhibition Codes and Messages: Lettering Today, held at the Crafts Council Gallery, Islington, London, from 30 November 1995 to 4 February 1996. [JC]    Publications history, trails & websites: Illustrated as figure 7 in Plate XIV (entitled 'Australian Message Sticks') opposite page 331 of 'Notes on Australian Message Sticks and Messengers', by A. W. Howitt, in Journal of the Anthropological Institute, Vol XVIII, 1889, pp. 314-332. (Copy in RDF). NB The original pencil drawings by Alfred Robinson used to produce the figures in Plate XIV are held in the PRM Manuscript Collections: Pitt Rivers Museum Papers / Box 2 / 1-3. [JC 20 9 2000, 17 6 2008]        Research notes: Described in Tylor papers Box 12 PRM ms collections Howitt 11 as 'August 8 1883 ... Message stick sent by a Flinders River blackfellow to another at the Mitchell River to say his wife was dead. From Mr Palmer. [3] [AP 06/02/2013]"	Piers Kelly	1889-Artefact_fig07-Howitt-Notes_on_Australian_message_sticks-p330-331.jpg;1889-Artefact_fig06-Howitt-Notes_on_Australian_message_sticks-p330-331.jpg;PRM-1989.46.8_01.png;PRM-1989.46.8_02.png	
